{
  "schema": "bold.tokens/0", "name": "hf-editorial",
  "color": { "ink": "#F4F1EA", "accent": "#C8553D", "muted": "#9A948A", "plate": "#1C1B19" },
  "typography": { "families": { "display": { "family": "Editorial Serif", "weight": 500 }, "body": { "family": "Editorial Sans", "weight": 400 } }, "scale": [1.8, 2.6, 3.8, 6, 9.5] },
  "spacing": { "unit": 1.6 }, "stroke": { "hair": 0.08, "base": 0.16, "bold": 0.4 },
  "motion": { "duration": { "fast": 0.3, "base": 0.8, "slow": 1.3 }, "stagger": 0.12, "ease": { "out": [0.22, 1, 0.36, 1], "in": [0.64, 0, 0.78, 0] } }
}
