{
  "schema": "bold.tokens/0", "name": "hf-bold-geometric",
  "color": { "ink": "#FFFFFF", "accent": "#FFD23F", "plate": "#141414" },
  "typography": { "families": { "display": { "family": "Geometric Sans", "weight": 860 }, "body": { "family": "Geometric Sans", "weight": 600 } }, "scale": [2.4, 3.6, 5.5, 9, 15] },
  "spacing": { "unit": 2 }, "stroke": { "hair": 0.15, "base": 0.4, "bold": 0.9 },
  "motion": { "duration": { "fast": 0.2, "base": 0.45, "slow": 0.8 }, "stagger": 0.035, "ease": { "out": [0.34, 1.4, 0.64, 1], "in": [0.6, 0, 0.9, 0.4] } }
}
